{"version":"2.0","nodes":[{"id":"node_cardiac_rhythm","system":"Cardiac Rhythm"},{"id":"node_heart_rate","system":"Heart Rate"},{"id":"node_breathing_rate","system":"Breathing Rate"},{"id":"node_breathing_depth","system":"Breathing Depth"},{"id":"node_sweat_level","system":"Sweat Level"},{"id":"node_sweat_reactivity","system":"Sweat Reactivity"},{"id":"node_skin_temperature","system":"Skin Temperature"},{"id":"node_muscle_tension","system":"Muscle Tension"}],"calibration":{"nodes":{"node_cardiac_rhythm":{"units":"a.u.","transform":"identity","inverse":"identity","precision":3,"mu":53.97070041369759,"sigma":37.19145026416591},"node_heart_rate":{"units":"bpm","transform":"identity","inverse":"identity","precision":1,"mu":77.66106733984432,"sigma":17.156897358349234},"node_breathing_rate":{"units":"breaths/min","transform":"identity","inverse":"identity","precision":1,"mu":18.21120503480587,"sigma":4.240153027160829},"node_breathing_depth":{"units":"a.u.","transform":"identity","inverse":"identity","precision":2,"mu":4.1833249836868065,"sigma":2.0092514008650704},"node_sweat_level":{"units":"µS","transform":"log1p","inverse":"expm1","precision":3,"mu":0.7223879970729475,"sigma":0.5986823510318076},"node_sweat_reactivity":{"units":"SCR/min","transform":"identity","inverse":"identity","precision":2,"mu":4178.463061690784,"sigma":2730.9675113318553},"node_skin_temperature":{"units":"°C","transform":"identity","inverse":"identity","precision":2,"mu":32.7308164826098,"sigma":1.5662083332013177},"node_muscle_tension":{"units":"µV","transform":"log1p","inverse":"expm1","precision":3,"mu":0.011352529932253065,"sigma":0.005298015240587583}}},"conditions":{"1":{"static":{"nodes":{"node_cardiac_rhythm":{"level":-0.03212815440242334,"slope":-0.00526625431048489,"accel":0.0008761020991494322,"var":8.966010864404193},"node_heart_rate":{"level":-0.30506212518848325,"slope":0.004560871173894028,"accel":0.003282407203660576,"var":1.935502627474984},"node_breathing_rate":{"level":0.06418694114748996,"slope":-0.004634459593704202,"accel":0.0006583297479560368,"var":1.2374013002389723},"node_breathing_depth":{"level":-0.4187153750731567,"slope":-0.009374718695631909,"accel":0.006260124529862529,"var":0.46101961845992623},"node_sweat_level":{"level":-0.2590055781517468,"slope":-0.03622546425316531,"accel":-0.0002718989899534589,"var":0.06290013140253553},"node_sweat_reactivity":{"level":-0.048666663584724504,"slope":0.017772820307395985,"accel":-0.010482150617863398,"var":1384.868298253706},"node_skin_temperature":{"level":0.36522645142477733,"slope":0.02038934154488285,"accel":0.0001988447586557086,"var":0.05271922957919756},"node_muscle_tension":{"level":0.36598381931614826,"slope":-0.01403552463356198,"accel":0.006281093182070231,"var":0.0017083591250822041}},"edges":{"Breathing Depth|Muscle Tension":{"static_conn":0.3001831802697675,"sync_rate":0.46704331450094155,"significant":false},"Breathing Depth|Skin Temperature":{"static_conn":0.3040492630284751,"sync_rate":0.4745762711864406,"significant":false},"Breathing Depth|Sweat Level":{"static_conn":0.28014463521572125,"sync_rate":0.45009416195856866,"significant":false},"Breathing Depth|Sweat Reactivity":{"static_conn":0.26355040261588175,"sync_rate":0.39924670433145004,"significant":false},"Breathing Rate|Breathing Depth":{"static_conn":0.3196471800921071,"sync_rate":0.5160075329566854,"significant":false},"Breathing Rate|Muscle Tension":{"static_conn":0.3242947664525991,"sync_rate":0.5291902071563087,"significant":false},"Breathing Rate|Skin Temperature":{"static_conn":0.33145891096474017,"sync_rate":0.5404896421845574,"significant":false},"Breathing Rate|Sweat Level":{"static_conn":0.3106698510382269,"sync_rate":0.5065913370998119,"significant":false},"Breathing Rate|Sweat Reactivity":{"static_conn":0.2944164871593184,"sync_rate":0.49340866290018814,"significant":false},"Cardiac Rhythm|Breathing Depth":{"static_conn":0.2875281036090046,"sync_rate":0.43502824858757067,"significant":false},"Cardiac Rhythm|Breathing Rate":{"static_conn":0.30962575086200833,"sync_rate":0.5348399246704331,"significant":false},"Cardiac Rhythm|Heart Rate":{"static_conn":0.31859692135990497,"sync_rate":0.5122410546139362,"significant":false},"Cardiac Rhythm|Muscle Tension":{"static_conn":0.2917246070407186,"sync_rate":0.48587570621468923,"significant":false},"Cardiac Rhythm|Skin Temperature":{"static_conn":0.29482214758071035,"sync_rate":0.5103578154425611,"significant":false},"Cardiac Rhythm|Sweat Level":{"static_conn":0.27448688509203456,"sync_rate":0.44067796610169496,"significant":false},"Cardiac Rhythm|Sweat Reactivity":{"static_conn":0.2628589645657862,"sync_rate":0.4199623352165725,"significant":false},"Heart Rate|Breathing Depth":{"static_conn":0.3279039400375848,"sync_rate":0.5122410546139362,"significant":false},"Heart Rate|Breathing Rate":{"static_conn":0.35136511503198803,"sync_rate":0.5800376647834277,"significant":false},"Heart Rate|Muscle Tension":{"static_conn":0.3311995190205409,"sync_rate":0.5310734463276838,"significant":false},"Heart Rate|Skin Temperature":{"static_conn":0.33489624446007243,"sync_rate":0.5743879472693034,"significant":false},"Heart Rate|Sweat Level":{"static_conn":0.3060227897125346,"sync_rate":0.5291902071563087,"significant":false},"Heart Rate|Sweat Reactivity":{"static_conn":0.29558644839567744,"sync_rate":0.4726930320150659,"significant":false},"Skin Temperature|Muscle Tension":{"static_conn":0.3147040522453603,"sync_rate":0.5047080979284368,"significant":false},"Sweat Level|Muscle Tension":{"static_conn":0.28999485236090794,"sync_rate":0.4689265536723163,"significant":false},"Sweat Level|Skin Temperature":{"static_conn":0.3000476654203561,"sync_rate":0.4745762711864406,"significant":false},"Sweat Level|Sweat Reactivity":{"static_conn":0.2529441254166453,"sync_rate":0.4030131826741995,"significant":false},"Sweat Reactivity|Muscle Tension":{"static_conn":0.2753423453589696,"sync_rate":0.42372881355932196,"significant":false},"Sweat Reactivity|Skin Temperature":{"static_conn":0.2799120989697543,"sync_rate":0.46139359698681726,"significant":false}}},"series":{"t":[0,30,60,90,120,150,180,210,240,270,300,330,360,390,420,450,480,510,540,570,600,630,660,690,720,750,780,810,840,870,900,930,960,990,1020,1050,1080],"nodes":{"node_cardiac_rhythm":{"level":[0.1062189529571778,0.1168084677170491,0.14134792421013506,0.10129397863082172,-0.019437263918797975,0.026875475607799532,0.02678826258522306,-0.1268653658466465,-0.15682016246531866,-0.11562248897848994,-0.16725565003509826,-0.2438569839194498,-0.18880324168698906,-0.14745351787727573,-0.13508095736127332,-0.06876714099285479,-0.04061685673836734,-0.0010510959213241616,0.11724732009432724,0.2514113135678749,0.094148834989529,-0.10926656295618178,-0.1696720555932615,-0.029459274231626947,-0.012578560202381597,-0.09042352054358412,-0.03145992779301316,0.010290744950697067,0.07290514205688857,-0.014160547892935388,-0.0418785276290145,0.09071462725026873,-0.040997039009169844,-0.1553901557375636,-0.062065597210739454,-0.09874298380384473,-0.07706727916225331],"slope":[0.0,-0.005444379167744757,0.03190039372762059,-0.031149510242324405,-0.1512616204811527,0.06941363568229598,0.02932020890018993,-0.17844414645196727,-0.1540072904632272,0.02877498177396572,-0.058654413079091305,-0.12741224733277037,0.05453679324981327,0.08447472340398424,-0.001883275959865058,0.1675254662389711,0.060467948137349396,-0.03485912460033814,0.22512277587281765,0.18987739491882927,-0.2258409687889525,-0.2852455876647449,-0.10651888178562793,0.2630528743504366,-0.05005072664929631,-0.07880814350714895,0.07701301921614219,-0.024181322042123428,0.1524838467601628,-0.021866936775815946,0.031815365249843665,0.16152521750583082,-0.2757113158790633,-0.17334081152179623,0.07909999939138992,0.05100887085693756,0.03241577766852899],"var":[0.0,5.848348744348983,9.873926968961698,10.316380384747822,9.909020915603197,10.24347515852134,9.37082676561217,9.805780334462167,8.624109324890888,9.226886587275615,8.728878667767047,7.732957893200022,6.430294234507822,6.319186131779972,6.263447345707388,7.020754574073281,8.239669123083226,9.229835736231342,12.489576334750188,13.045124201323285,13.614465799902307,12.833779239424505,11.023135026664686,9.65425810623557,7.187446877551638,6.893803774379944,6.90998720594943,7.458881017658679,8.814371934063628,10.468542053270301,10.945574735163886,10.900690281466199,10.772696313338153,10.299460487403085,8.898259199903215,9.081291216248834,7.267279287483615]},"node_heart_rate":{"level":[-0.3002157602780233,-0.3669988020767635,-0.33946305316775366,-0.354701432980424,-0.3526407921676347,-0.3205856317381876,-0.34788563694171143,-0.34605220873089154,-0.3201806219176202,-0.3272129293005919,-0.3115444477730312,-0.2741580562002395,-0.2790032454464442,-0.2838897720647195,-0.28832720661708733,-0.28809720701547625,-0.2885097512889349,-0.32683888728741123,-0.2977897067388436,-0.3193931553749337,-0.3580284891329488,-0.3354990269142273,-0.29000995687193903,-0.30241472157561383,-0.3177233604350554,-0.2837035256273092,-0.30908299736542205,-0.3323942361266607,-0.3586491718286804,-0.29625134803927394,-0.2159556991067864,-0.23390710210220642,-0.26177536880024055,-0.28882977615530986,-0.3063972181159355,-0.2518546570732697,-0.21133367159627742],"slope":[0.0,-0.08287614987106932,-0.014887142900251008,-0.05010825769661601,0.025668824032459243,0.0665943659489889,-0.04788403551869315,-0.0001227302634160424,0.04797878168247507,-0.07345404886540817,0.01456112446002894,0.08975656344719186,0.0033966140175442023,-0.004227992670058848,-0.035040809993300406,0.012800317307725536,0.00787563038064524,-0.07656478452734332,0.11098809421061605,0.001230837728641243,-0.09347905982939249,0.0004428818857628263,0.11519496854340347,0.0316713333007549,-0.05611467241227453,0.0198559124901165,-0.06989160283548772,-0.008900855445098681,-0.03638829472313996,0.08615810820913807,0.126234149564488,-0.01270394721903813,-0.03125693480138953,-0.07449243440074296,-0.03003431918108741